{"backend_slo":{"collector_id":"otel-production-01","policy_sha256":"7ff3b14ccaa588f60e5cef2ad5346b5611d4a41f11b1e95f7d4b8fff7926f2d4","public_key_sha256":"abababababababababababababababababababababababababababababababab","signing_key_id":"backend-slo-authority-2026"},"policy_id":"market-policy-2026-08","previous_record_sha256":"0000000000000000000000000000000000000000000000000000000000000000","record_id":"market-record-000001","release_public_key_sha256":"ffffffffffffffffffffffffffffffffffffffffffffffffffffffffffffffff","release_sequence":1,"release_signing_key_id":"market-release-authority-2026","required_evidence":[{"evidence_type":"agent_security_privacy","max_age_seconds":604800,"public_key_sha256":"1111111111111111111111111111111111111111111111111111111111111111","signing_key_id":"security-privacy-authority-2026"},{"evidence_type":"alpha_fleet","max_age_seconds":1209600,"public_key_sha256":"2222222222222222222222222222222222222222222222222222222222222222","signing_key_id":"fleet-authority-2026"},{"evidence_type":"backend_supply_chain","max_age_seconds":86400,"public_key_sha256":"3333333333333333333333333333333333333333333333333333333333333333","signing_key_id":"backend-release-authority-2026"},{"evidence_type":"companion_apps","max_age_seconds":604800,"public_key_sha256":"4444444444444444444444444444444444444444444444444444444444444444","signing_key_id":"app-release-authority-2026"},{"evidence_type":"device_soak_power_acoustic","max_age_seconds":2592000,"public_key_sha256":"5555555555555555555555555555555555555555555555555555555555555555","signing_key_id":"device-qualification-authority-2026"},{"evidence_type":"factory_boot_storage_onboarding","max_age_seconds":2592000,"public_key_sha256":"6666666666666666666666666666666666666666666666666666666666666666","signing_key_id":"factory-security-authority-2026"},{"evidence_type":"firmware_supply_chain","max_age_seconds":86400,"public_key_sha256":"7777777777777777777777777777777777777777777777777777777777777777","signing_key_id":"firmware-release-authority-2026"},{"evidence_type":"kubernetes_live_admission","max_age_seconds":604800,"public_key_sha256":"8888888888888888888888888888888888888888888888888888888888888888","signing_key_id":"cluster-qualification-authority-2026"},{"evidence_type":"legal_market","max_age_seconds":7776000,"public_key_sha256":"9999999999999999999999999999999999999999999999999999999999999999","signing_key_id":"legal-market-authority-2026"},{"evidence_type":"managed_postgresql_resilience","max_age_seconds":604800,"public_key_sha256":"aaaaaaaaaaaaaaaaaaaaaaaaaaaaaaaaaaaaaaaaaaaaaaaaaaaaaaaaaaaaaaaa","signing_key_id":"data-resilience-authority-2026"},{"evidence_type":"ota_release_chain","max_age_seconds":86400,"public_key_sha256":"bbbbbbbbbbbbbbbbbbbbbbbbbbbbbbbbbbbbbbbbbbbbbbbbbbbbbbbbbbbbbbbb","signing_key_id":"ota-release-authority-2026"},{"evidence_type":"push_provider_delivery","max_age_seconds":604800,"public_key_sha256":"f0f0f0f0f0f0f0f0f0f0f0f0f0f0f0f0f0f0f0f0f0f0f0f0f0f0f0f0f0f0f0f0","signing_key_id":"push-delivery-authority-2026"},{"evidence_type":"reset_resale_hardware","max_age_seconds":2592000,"public_key_sha256":"cccccccccccccccccccccccccccccccccccccccccccccccccccccccccccccccc","signing_key_id":"reset-qualification-authority-2026"},{"evidence_type":"speech_backup_adapter","max_age_seconds":604800,"public_key_sha256":"dddddddddddddddddddddddddddddddddddddddddddddddddddddddddddddddd","signing_key_id":"speech-backup-authority-2026"},{"evidence_type":"speech_primary_adapter","max_age_seconds":604800,"public_key_sha256":"eeeeeeeeeeeeeeeeeeeeeeeeeeeeeeeeeeeeeeeeeeeeeeeeeeeeeeeeeeeeeeee","signing_key_id":"speech-primary-authority-2026"}],"schema_version":2,"subject":{"deployment_id":"backend-pilot-uswest-0001","firmware_security_version":1,"firmware_sha256":"e0fb94944718cc35f10a77e3aa7d0c0e1a835836781b0af38a5eced8663363f6","oci_release_id":"backend-release-0001","ota_release_id":"firmware-release-0001","product_release_id":"voice-agent-kit-0001","product_version":"1.0.0","qualification_id":"cluster-qualification-0001","sku":"VOICE_AGENT_KIT_BOX3"},"tool_sha256":"55b80b7c2c3a1b68b71c180d5e4f108a37e56a12e5f40125f4a022cadabc79be","valid_from":"2026-08-15T00:00:00Z","valid_until":"2026-09-14T00:00:00Z"}
